{"$schema":"https://json-schema.org/draft/2020-12/schema","$id":"https://github.com/martin-beck/agent-workflow-quality/schemas/discussion-tui-integration.schema.json","title":"AWQ end-to-end discussion TUI integration contract v1","type":"object","additionalProperties":false,"required":["schema_version","task","session_mode","event_refs","stages","panes","batch","proposals","persistence","reconciliation","handoff","privacy_projection","limitations"],"properties":{"schema_version":{"const":1},"task":{"type":"object","additionalProperties":false,"required":["id","revision"],"properties":{"id":{"type":"string","pattern":"^AR-[0-9]{4}$"},"revision":{"type":"integer","minimum":1}}},"session_mode":{"enum":["agent-initiated","user-initiated"]},"event_refs":{"type":"array","minItems":1,"uniqueItems":true,"items":{"type":"string","pattern":"^EV-[A-Z0-9-]+$"}},"stages":{"type":"array","minItems":7,"maxItems":7,"items":{"type":"object"}},"panes":{"type":"object"},"batch":{"type":"object"},"proposals":{"type":"array"},"persistence":{"type":"object"},"reconciliation":{"type":"object"},"handoff":{"type":"object"},"privacy_projection":{"type":"object"},"limitations":{"type":"array"}}}
