{"batch":{"candidate_count":1,"custom_count":1,"independent_evaluation":true,"point_count":2},"event_refs":["EV-AR0065-SESSION","EV-AR0065-PANES","EV-AR0065-BATCH","EV-AR0065-EVAL","EV-AR0065-PERSIST","EV-AR0065-RECON","EV-AR0065-HANDOFF"],"handoff":{"ar_ref":"AR-0066","authorized":false,"classification":"new-ar"},"limitations":["ui_behavior_not_proven","user_intent_not_proven","implementation_refinement_not_proven","provider_execution_not_proven","consumer_native_gates_remain_authoritative"],"panes":{"left_document_sha256":"1111111111111111111111111111111111111111111111111111111111111111","left_point_id":"POINT-AR0065-1","right_document_sha256":"2222222222222222222222222222222222222222222222222222222222222222","right_point_id":"POINT-AR0065-1","synchronized":true},"persistence":{"reask_required":true,"record_ref":"discussion-persistence/ar-0064-example.json","record_sha256":"3333333333333333333333333333333333333333333333333333333333333333","safe_exit":true},"privacy_projection":{"projection_sha256":"4444444444444444444444444444444444444444444444444444444444444444","public_safe":true,"redacted_fields":["prompt","transcript","credentials","private_paths"]},"proposals":[{"evaluation_sha256":"5555555555555555555555555555555555555555555555555555555555555555","id":"PROP-AR0065-CANDIDATE","kind":"candidate","status":"evaluated"},{"evaluation_sha256":"6666666666666666666666666666666666666666666666666666666666666666","id":"PROP-AR0065-CUSTOM","kind":"custom","status":"evaluated"}],"reconciliation":{"evidence_ref":"discussion-reconciliation/example.json","result_sha256":"7777777777777777777777777777777777777777777777777777777777777777","status":"passed"},"schema_version":1,"session_mode":"user-initiated","stages":[{"event_ref":"EV-AR0065-SESSION","evidence_ref":"discussion-tui/ar-0062-example.json","name":"session","status":"complete","task_revision":2},{"event_ref":"EV-AR0065-PANES","evidence_ref":"discussion-tui/ar-0062-example.json","name":"pane-sync","status":"complete","task_revision":3},{"event_ref":"EV-AR0065-BATCH","evidence_ref":"discussion-batch/ar-0063-example.json","name":"batching","status":"complete","task_revision":4},{"event_ref":"EV-AR0065-EVAL","evidence_ref":"discussion-batch/ar-0063-example.json","name":"evaluation","status":"complete","task_revision":5},{"event_ref":"EV-AR0065-PERSIST","evidence_ref":"discussion-persistence/ar-0064-example.json","name":"persistence","status":"complete","task_revision":6},{"event_ref":"EV-AR0065-RECON","evidence_ref":"discussion-reconciliation/example.json","name":"reconciliation","status":"complete","task_revision":7},{"event_ref":"EV-AR0065-HANDOFF","evidence_ref":"oracle-workflow-integration/ar-0061-example.json","name":"handoff","status":"complete","task_revision":8}],"task":{"id":"AR-0065","revision":2}}
